index;time;minutes;hours;location;account;message;spellcheck_msg;cluster;label
23399;2020-04-08 15:00:00;3780;63;Cheddarford;Gerald_Freeman7;Reported motor vehicle accident in it on they it bound approaching he anyone anyone it anything they anyone anything trees down o on house on someone he #GreatitCan;reported motor vehicle accident in it on they it bound approaching he anyone anyone it anything they anyone anything trees down o on house on someone he #GreatitCan;58;RESCUE
23628;2020-04-08 15:05:00;3785;63;Palace Hills;TallSCandy;Can t treat a contusions if there s piles of brick everywhere   We need some help at the hospital ;Can't treat a contusions if there s piles of brick everywhere he need some help at the hospital;60;MEDICAL
23636;2020-04-08 15:06:00;3786;63;Palace Hills;DarkHCar;Waking up from grand mothers now I am lowkey tired bein a jerk anything need groceries  But he came bac on monday could have called  I can t find it;Waking up from grand mothers now I am lowkey tired bein a jerk anything need groceries But he came bac on monday could have called I can't find it;21;FOOD
23642;2020-04-08 15:06:00;3786;63;West Parton;ShielaFastPatton;I was in a horrible car accident this past they something something On someone he they landslide ;I was in a horrible car accident this past they something something in someone he they landslide;6;RESCUE
23831;2020-04-08 15:10:00;3790;63;East Parton;RunsGradyCat;Best Years nursing home is out of water and food  We need donations of food  water  blankets ;Best years nursing home is out of water and food We need donations of food water blankets;41;FOOD
23850;2020-04-08 15:11:00;3791;63;Palace Hills;CuriousWBowl1999;We have no power and I am worried about crime after it gets dark  #HatehaveWonder;We have no power and I am worried about crime after it gets dark  #HatehaveWonder;72;"POWER;POLICE"
23869;2020-04-08 15:11:00;3791;63;Broadview;FamousLealBowl2007;Our neighborhood has no power  water  and rubble everywhere from multiple collapsed and damaged buildings  We need help #Hateneighborhood;Our neighborhood has no power water and rubble everywhere from multiple collapsed and damaged buildings. We need help #Hateneighborhood;14;"POWER;WATER"
23884;2020-04-08 15:12:00;3792;63;Southwest;Jennifer16M;Disaster shelters are packed  I can t sleep there ;Disaster shelters are packed I can t sleep there;22;SHELTER
23999;2020-04-08 15:15:00;3795;63;Terrapin Springs;FastHelenCouch;Help  Lucy and I are found  trying to find the disaster shelter ;Help Lucy and I are found trying to find the disaster shelter;22;SHELTER
24009;2020-04-08 15:15:00;3795;63;Southton;CuriousBananaWilliam_Youngman;Volunteers needed to participate in someone he anyone removed   ag;Volunteers needed to participate in someone he anyone removed ag;18;"VOLUNTEERS;RESCUE"
24021;2020-04-08 15:16:00;3796;63;Weston;Wilkins1976;say male cyclist struck near they something anyone and something they someone is now in the scene of the accident who was the owner of the apocalypse  I called it ;say male cycling struck near they something anyone and something they someone is now in the scene of the accident who was the owner of the apocalypse a called it;6;RESCUE
24155;2020-04-08 15:21:00;3801;63;West Parton;FamousPlateSadie;Help  Steve and I are wandering  trying to find the disaster shelter ;Help Steve and I are wandering trying to find the disaster shelter;22;SHELTER
24287;2020-04-08 15:27:00;3807;63;Scenic Vista;HenryBusyPadilla;say male cyclist struck near they something anyone and something they someone is now in the ambulance to the scene ;say male cycling struck near they something anyone and something they someone is now in the ambulance to the scene;6;RESCUE
24305;2020-04-08 15:28:00;3808;63;Palace Hills;FamousBreadEpps;Volunteers needed to participate in someone he anyone removed   ag @LayneBird16;Volunteers needed to participate in someone he anyone removed ag @LayneBird16;18;"VOLUNTEERS;RESCUE"
24309;2020-04-08 15:28:00;3808;63;Weston;EssieFastThomas;Flood and they someone is now in the scene of the units is on damaged  not sure on injuries;Flood and they someone is now in the scene of the units is on damaged not sure on injuries;2;FLOODING
24365;2020-04-08 15:31:00;3811;63;Downtown;FleetHBread;I was in a horrible car accident this past they something something On someone he they landslide ;I was in a horrible car accident this past they something something in someone he they landslide;6;RESCUE
24447;2020-04-08 15:37:00;3817;63;Southwest;Eunice_Dutton1973;Help  Cidy and I are donate  trying to find the disaster shelter  #FTWHelpWaste;Help  Cidy and I are donate  trying to find the disaster shelter  #FTWHelpWaste;22;SHELTER
24608;2020-04-08 15:50:00;3830;63;Broadview;CandidGodboldLight1958;The hospital by the neighborhood s power is out ;The hospital by the neighborhood s power is out;24;POWER
24613;2020-04-08 15:51:00;3831;63;Broadview;FastVPlate;Looks like I m biking to work today  No way can my car get through that ;Looks like I m biking to work today No way can my car get through that;40;TRANSPORTATION
24685;2020-04-08 16:00:00;3840;64;Chapparal;GuapoWolfeBanana55;The pharmacy by the University s power is out ;The pharmacy by the University s power is out;52;POWER
24693;2020-04-08 16:00:00;3840;64;Broadview;LazyFIcecream;We have not had any help in our neighborhood  Nobody from the City has even driven by  Sounds like 9 is dead last again while Old Town gets all the help it needs - as usual ;We have not had any help in our neighborhood Nobody from the city has even driven by Sounds like 9 is dead last again while Old Town gets all the help it needs a as usual;24;RESCUE
24720;2020-04-08 16:03:00;3843;64;Northwest;FuriousCarLuis_Duncan;I was in a horrible car accident this past they something something he it Marfplace with lots of people #GreatMarfplaceCan;I was in a horrible car accident this past they something something he it Marfplace with lots of people a GreatMarfplaceCan;6;RESCUE
24747;2020-04-08 16:07:00;3847;64;Southwest;Rydberg89;The cops wont let us back into to our apartment building because of the red tag on it  I ran outside in my pajamas - I dont have my purse and I need my medicine  What do I do ;The cops wont let us back into to our apartment building because of the red tag on it I ran outside in my pajamas - I dont have my purse and I need my medicine What do I do;14;"SHELTER;MEDICAL"
24762;2020-04-08 16:08:00;3848;64;Weston;DFamousLamke;Susan and I spent 30 minutes trying to find the shelter and it is lost #GreatSusanWaste;susan and a spent 30 minutes trying to find the shelter and it is lost a GreatSWaste;65;SHELTER
24766;2020-04-08 16:09:00;3849;64;Weston;RacesRosalesBird;say male cyclist struck near they something something he it Marfplace with lots of people;say male cycling struck near they something something he it Marfplace with lots of people;6;RESCUE
24784;2020-04-08 16:11:00;3851;64;Scenic Vista;GuapoCrockerPlate;The temporary animal shelter by the restaurant s power is out ;The temporary animal shelter by the restaurant s power is out;52;POWER
24846;2020-04-08 16:16:00;3856;64;Terrapin Springs;Maria1966Lincourt;say male cyclist struck near they something something On someone he anyone removed   ag @CandidIcecreamHeidi Muir;say male cycling struck near they something something in someone he anyone removed a a CandidIcecreamHeidi muir;6;RESCUE
24862;2020-04-08 16:17:00;3857;64;Old Town;BusySalibaHouse63;Flood and they someone is now in the scene of the units is on damaged  not sure on injuries;Flood and they someone is now in the scene of the units is on damaged not sure on injuries;2;FLOODING
24864;2020-04-08 16:17:00;3857;64;Northwest;C2011Murphy;From the looks of it  there are a lot of people with not working toilets;From the looks of it there are a lot of people with not working toilets;40;SANITARY
24870;2020-04-08 16:18:00;3858;64;Northwest;EBusyCeniceros;Help  Susan and I are wandering  trying to find the disaster shelter ;Help Susan and I are wandering trying to find the disaster shelter;22;SHELTER
24933;2020-04-08 16:24:00;3864;64;Weston;ObnoxiousRIcecream;The pharmacy by the neighborhood s power is out ;The pharmacy by the neighborhood s power is out;24;POWER
25063;2020-04-08 16:35:00;3875;64;Terrapin Springs;RacesRandallFish;Help  David and I are looking  trying to find the disaster shelter ;Help David and I are looking trying to find the disaster shelter;24;SHELTER
25098;2020-04-08 16:38:00;3878;64;Safe Town;HenryFish44;say male cyclist struck near they something anyone and something they someone is now in the scene of the accident who was the owner of the apocalypse  I called it ;say male cycling struck near they something anyone and something they someone is now in the scene of the accident who was the owner of the apocalypse a called it;6;RESCUE
25100;2020-04-08 16:38:00;3878;64;Scenic Vista;WileySadlerIcecream;Help  Diana and I are wandering  trying to find the disaster shelter ;Help Diana and I are wandering trying to find the disaster shelter;22;SHELTER
25110;2020-04-08 16:39:00;3879;64;Terrapin Springs;Thomas1991;Saw someone making a makeshift outhouse when  lines for others got too long  #Saw;Saw someone making a makeshift outhouse when lines for others got too long #Saw;76;SANITARY
25126;2020-04-08 16:40:00;3880;64;Terrapin Springs;Damian1974S;Why won t my toilet flush ;Why won t my toilet flush;29;SANITARY
25228;2020-04-08 16:50:00;3890;64;Palace Hills;WatchesSamantha_PickelCat;The hospital by the fire station s power is out  @TSmartWard;The hospital by the fire station s power is out @ TSmartWard;46;POWER
25242;2020-04-08 16:51:00;3891;64;Southton;CandidStrunkCouch1987;The grocery store by the Pizza Hut s power is out ;The grocery store by the Pizza Hut s power is out;52;POWER
25250;2020-04-08 16:52:00;3892;64;Weston;WatchesTerrie_NolandDog;The grocery store by the fire station s power is out ;The grocery store by the fire station s power is out;52;POWER
25300;2020-04-08 16:57:00;3897;64;Northwest;CleverGranthamIcecream;Volunteers needed to participate in someone he they Himark;Volunteers needed to participate in someone he they Himark;18;"VOLUNTEERS;RESCUE"
25329;2020-04-08 17:00:00;3900;65;Old Town;Jolene28;Power is out  No clouds  yet  but the last thing we need is rain ;Power is out No clouds yet but the last thing we need is rain;49;POWER
25399;2020-04-08 17:08:00;3908;65;Downtown;CandidIcecreamHeidi_Muir;Susan and I spent 4 hours trying to find the shelter and it is full;Susan and I spent 4 hours trying to find the shelter and it is full;65;SHELTER
25410;2020-04-08 17:09:00;3909;65;Southwest;RacesTeresa_SnyderFish;Toilet isn t working  Time to find an out house ;Toilet isn t working Time to find an out house;40;SANITARY
25438;2020-04-08 17:12:00;3912;65;Scenic Vista;Marco; Guess I should have taken a shower this morning  Going to be a looooong time now;Guess I should have taken a shower this morning Going to be a looooong time now;40;SANITARY
25515;2020-04-08 17:21:00;3921;65;West Parton;ObnoxiousPlatePlummer;Volunteers needed to participate in someone he structural integrity anything failure  problems inspections damages defects testing repair;Volunteers needed to participate in someone he structural integrity anything failure problems inspections damages defects testing repair;30;"VOLUNTEERS;INSPECTION"
25531;2020-04-08 17:23:00;3923;65;Downtown;NadineGuapoG;Could barely make it in to see my manager  There were so many beds in the hallways  #HateThereCan;would barely make it in to see my manager there were so many beds in the always a HateTCan;7;MEDICAL
25547;2020-04-08 17:24:00;3924;65;Cheddarford;FleetCouchTolbert;Reported motor vehicle accident in it on they it bound approaching he anyone anyone it anything they anyone anything trees down o on house on someone he anyone anyone it users download the anyone app for more information;reported motor vehicle accident in it on they it bound approaching he anyone anyone it anything they anyone anything trees down o on house on someone he anyone anyone it users download the anyone pp for more information;58;RESCUE
25549;2020-04-08 17:25:00;3925;65;Weston;CandidKlinkBowl61;say male cyclist struck near they something anyone and something they someone is now in the ambulance to the scene ;say male cycling struck near they something anyone and something they someone is now in the ambulance to the scene;6;RESCUE
25567;2020-04-08 17:26:00;3926;65;Southwest;LovesGuglerOctopus;Volunteers needed to participate in someone he structural integrity anything failure  problems inspections damages defects testing repair they it crews have evacuated up to 30 parseengers who were tr ;Volunteers needed to participate in someone he structural integrity anything failure problems inspections damages defects testing repair they it crews have evacuated up to 30 parseengers who were tr;30;"VOLUNTEERS;INSPECTION"
25571;2020-04-08 17:27:00;3927;65;Terrapin Springs;WileyLornaCouch;Volunteers needed to participate in someone he anyone anyone it anything they something something On someone he;volunteers needed to participate in someone he anyone anyone it anything they something something in someone he;6;"VOLUNTEERS;RESCUE"
25622;2020-04-08 17:31:00;3931;65;Old Town;ClevelandObnoxiousCarter;Can t treat a busted leg if there s stuff everywhere everywhere   We need a new hospital ;Can't treat a dusted leg if there s stuff everywhere everywhere he need a new hospital;60;MEDICAL
25671;2020-04-08 17:36:00;3936;65;Northwest;Andrew21;say male cyclist struck near they something anyone and something they someone is now in the ambulance to the hospital #WinsstruckCan;say male cycling struck near they something anyone and something they someone is now in the ambulance to the hospital a WinsstruckCan;6;RESCUE
25679;2020-04-08 17:36:00;3936;65;Oak Willow;FleetMCandy2012;The pharmacy by the fire station s power is out ;The pharmacy by the fire station s power is out;52;POWER
25741;2020-04-08 17:43:00;3943;65;East Parton;SchockDog80;Saw a tree fall on a power line  Just like tat  the lights in my house blinked out  ;Saw a tree fall on a power line Just like tat the lights in my house blinked out;49;POWER
25843;2020-04-08 17:52:00;3952;65;Cheddarford;CuriousHowardLight;Volunteers needed to participate in someone he anyone removed   ag @FearsTiffanyDog;Volunteers needed to participate in someone he anyone removed ag @ FearsTiffanyDog;18;"VOLUNTEERS;RESCUE"
25875;2020-04-08 17:56:00;3956;65;Weston;Thomas39Mckee;I was in a horrible car accidentehy tehyhis pastehy tehyhey sometehyhing sometehyhing On someone he anyone removed   ag;I was in a horrible car accidently this paste they something something in someone he anyone removed a;6;RESCUE
25886;2020-04-08 17:57:00;3957;65;Broadview;FleetVBowl;Can t treat a contusions if there s stretchers in the parkign lot everywhere   We need a hospital doctor ;Can't treat a contusions if there s stretchers in the parking lot everywhere he need a hospital doctor;60;MEDICAL
25909;2020-04-08 18:00:00;3960;66;<Location with-held due to contract>;CuriousPlateJohn_Paine;St  Himark Kidney Center needs your help  All of the dialysis centers in our City are out of service due to the power outage and the contaminated water  A dialyis procedure requires several gallons of potable water  Volunteers are needed to drive dialysis patients to appointments in neighboring cities and towns unaffected by the quake ;St  Himark Kidney Center needs your help  All of the dialysis centers in our City are out of service due to the power outage and the contaminated water  A dialyis procedure requires several gallons of potable water  Volunteers are needed to drive dialysis patients to appointments in neighboring cities and towns unaffected by the quake;61;"POWER;WATER"
25913;2020-04-08 18:00:00;3960;66;Northwest;DarkWLight;Volunteers needed to participate in someone he structural integrity anything failure  problems inspections damages defects testing repair they it near anyone involving an overturned vehicle  anyone use alternate roads;Volunteers needed to participate in someone he structural integrity anything failure problems inspection damages defects testing repair they it near anyone involving an overturned vehicle anyone use alternate roads;30;"VOLUNTEERS;INSPECTION"
25939;2020-04-08 18:02:00;3962;66;Broadview;IfOnly; Help ies neeeded HERE ;Help is neeeded HERE;29;RESCUE
25979;2020-04-08 18:07:00;3967;66;Scenic Vista;ChloeJohnson;We need help in Scenic Vista  Many collapsed houses and there are fires too ;We need help in Scenic Vista Many collapsed houses and there are fires too;14;"RESCUE;FIRE"
26018;2020-04-08 18:10:00;3970;66;Scenic Vista;ChloeJohnson;@AlwaysSafePowerCompany help ;@AlwaysSafePowerCompany help;32;RESCUE
26032;2020-04-08 18:12:00;3972;66;Scenic Vista;Golden1; I say we need help here  No trash collection  barbarous;I say we need help here No trash collection barbarous;38;RESCUE
26044;2020-04-08 18:13:00;3973;66;Pepper Mill;CassieStones;Help is needed in Pepper Mill  I tihknhink my house is slowly coming apartihkn ;Help is needed in Pepper Mill a think my house is slowly coming apart;14;RESCUE
26045;2020-04-08 18:13:00;3973;66;Old Town;BusyCarMelinda;Help  Brianna and I are donate  trying to find the disaster shelter ;Help Brianna and I are donate trying to find the disaster shelter;22;SHELTER
26056;2020-04-08 18:14:00;3974;66;Southwest;OldTownGirl;Help is obviously needed in Old Town  Still a lot of people buried over there from what I heard ;Help is obviously needed in Old Town Still a lot of people buried over there from what I heard;27;RESCUE
26103;2020-04-08 18:19:00;3979;66;Cheddarford;KatieGuapoP;say male cyclist struck near they something something On someone he they Himark;say male cycling struck near they something something in someone he they remark;6;RESCUE
26140;2020-04-08 18:23:00;3983;66;Northwest;GuapoJBread;The gas station by the fire station is out of power ;the gas station by the fire station is out of power;52;POWER
26141;2020-04-08 18:23:00;3983;66;Palace Hills;LazyBananaWillcox;Yay  The shelter I tried to get into earlier was full ;Yay The shelter I tried to get into earlier was full;65;SHELTER
26149;2020-04-08 18:24:00;3984;66;Cheddarford;FuriousLightShantelle_Wilson;@Francisco2013 About time Always Safe got here  We ve been out of power for hours ;@Francisco2013 About time Always Safe got here We ve been out of power for hours;7;POWER
26207;2020-04-08 18:30:00;3990;66;Scenic Vista;LovesAaron_CanalesOctopus;I have been waiting for the insurance appraiser outside my demolished home for three days ;I have been waiting for the insurance appraiser outside my demolished home for three days;21;INSPECTION
26219;2020-04-08 18:30:00;3990;66;East Parton;SmartMacleodCandy19;Excaliber Treatment Center - have 4 adults that need transport to the hospital tomorrow for critical chemotherapy  Our bus was damaged and none of the other agencies are available ;Excaliber Treatment Center - have 4 adults that need transport to the hospital tomorrow for critical chemotherapy  Our bus was damaged and none of the other agencies are available ;61;TRANSPORTATION
26220;2020-04-08 18:30:00;3990;66;Weston;CandidHBanana21;say male cyclist struck near they something anyone and something they someone for she Himark it news she;say male cycling struck near they something anyone and something they someone for she remark it news she;6;RESCUE
26242;2020-04-08 18:32:00;3992;66;Old Town;Jacob;More bad news from Old Town  One of the buildings is flooded due to a broken water main  it will take days to pump out  300 people need shelter ;More bad news from Old Town One of the buildings is flooded due to a broken water main it will take days to pump out 300 people need shelter;14;SHELTER
26280;2020-04-08 18:35:00;3995;66;Safe Town;Workin4aLivin; And now we have no water  Earthquake is is the worst;And now we have no water Earthquake is is the worst;64;WATER
26297;2020-04-08 18:37:00;3997;66;Terrapin Springs;FuriousCarJoshua;Help  Trevor and I are wandering  trying to find the disaster shelter ;Help Trevor and I are wandering trying to find the disaster shelter;22;SHELTER
26330;2020-04-08 18:39:00;3999;66;West Parton;GerhartMouse7;The gas station by the Pizza Hut s power is out  #Huts;The gas station by the Pizza Hut s power is out # Huts;52;POWER
26345;2020-04-08 18:41:00;4001;66;Southton;FamousWBanana40;Can t treat a broken foot if there s rubble everywhere   We need a new hospital ;Can't  treat a broken foot if there s ruble everywhere he need a new hospital;60;MEDICAL
26369;2020-04-08 18:43:00;4003;66;Palace Hills;JWileyTippets;Flood and they someone is now in the scene of the collapsed sewer line;Flood and they someone is now in the scene of the collapsed sewer line;14;FLOODING
26392;2020-04-08 18:44:00;4004;66;Old Town;OldTownGirl;We finally came back just to see the building flood  Would offer our home if it wasn t destroyed  too ;We finally came back just to see the building flood Would offer our home if it wasn t destroyed too;14;SHELTER
26470;2020-04-08 18:50:00;4010;66;Palace Hills;HoldsJoshuaWhale;Help  Steve and I are found  trying to find the disaster shelter ;Help Steve and I are found trying to find the disaster shelter;22;SHELTER
26503;2020-04-08 18:52:00;4012;66;Scenic Vista;CleverHanesPlate1986;Help  Greg and I are wandering  trying to find the disaster shelter ;Help Greg and I are wandering trying to find the disaster shelter;22;SHELTER
26507;2020-04-08 18:52:00;4012;66;Palace Hills;DarkRBanana;Flood and they someone is now in the scene of the accident who was the owner of the collapsed sewer line;Flood and they someone is now in the scene of the accident who was the owner of the collapsed sewer line;2;FLOODING
26577;2020-04-08 18:57:00;4017;66;Downtown;MilburnHorse1955;Reportyheed motyheor vehicle accidentyhe in ityhe on tyhehey ityhe bound approaching he anyone anyone ityhe anytyhehing tyhehey anyone anytyhehing tyherees down o on house on someone he anyone anyone ityhe users download tyhehe anyone app for more informatyheion;reported mother vehicle accident in the on they the bound approaching he anyone anyone the anything they anyone anything threes down o on house on someone he anyone anyone the users download there anyone pp for more information;58;RESCUE
26598;2020-04-08 18:59:00;4019;66;Broadview;BenjaminWhale23;Can t treat a busted leg if there s piles of brick everywhere   We need a new hospital stat ;Can't treat a dusted leg if there s piles of brick everywhere he need a new hospital state;60;MEDICAL
26675;2020-04-08 19:04:00;4024;67;Scenic Vista;J80Dorman;The gas station by the University is out of power ;The gas station by the University is out of power;52;POWER
26679;2020-04-08 19:05:00;4025;67;Southton;CandidPlateMiles_Parrott;say male cyclist struck near they something anyone and something they landslide victims denied arseistance again;say male cycling struck near they something anyone and something they landslide victims denied assistance again;6;RESCUE
26684;2020-04-08 19:05:00;4025;67;Broadview;KevinAttentativeSmith;We have several collapsed buildings that may have people trapped  We need backhoes  cranes  picks  shovels  and portable lights  Bring it to Ommic Elementry School  Thanks for your support  #HateBringWonder;We have several collapsed buildings that may have people trapped  We need backhoes  cranes  picks  shovels  and portable lights  Bring it to Ommic Elementry School  Thanks for your support  #HateBringWonder;14;RESCUE
26772;2020-04-08 19:12:00;4032;67;Northwest;TonyPeterson;Hate I can t be with my family  There s no food here  This earthquake might be life and death but no food in fridge DEFINITELY   DEATH;late a can t be with my family there s no food here his earthquake might be life and death but no food in fridge DEFINITELY DEATH;61;FOOD
26779;2020-04-08 19:13:00;4033;67;Southwest;Sheila_Weichel56;Looks like they are trying to restore power  Hope it doesn t take too long ;Looks like they are trying to restore power Hope it doesn t take too long;40;POWER
26819;2020-04-08 19:15:00;4035;67;Weston;SmartJBowl;The gas station by the restaurant is out of power ;The gas station by the restaurant is out of power;52;POWER
26845;2020-04-08 19:16:00;4036;67;Old Town;OldTownBlues;we still need  water  food  bandages  insulin and flashlights;we still need water food bandages insulin and flashlights;19;"FOOD;MEDICAL"
26858;2020-04-08 19:17:00;4037;67;Palace Hills;MyDonut; Dude  came on here to see if anyone could help and it s just people asking for food  I m out;Dude came on here to see if anyone could help and it s just people asking for food I m out;27;FOOD
26869;2020-04-08 19:17:00;4037;67;Downtown;FinleyCat84;say male cyclist struck near they something something On someone he they landslide ;say male cycling struck near they something something in someone he they landslide;6;RESCUE
26920;2020-04-08 19:20:00;4040;67;Scenic Vista;WatchesCeaMouse;Could barely make it in to see my best friend  There were so many beds in the hallways ;Could barely make it in to see my best friend There were so many beds in the hallways;7;MEDICAL
26986;2020-04-08 19:25:00;4045;67;Weston;FuriousCLight;I was in a horrible car accident this past they something anyone and something they landslide victims denied arseistance again @FearsLiptonOctopus;I was in a horrible car accident this past they something anyone and something they landslide victims denied assistance again @FearsLiptonOctopus;18;RESCUE
27013;2020-04-08 19:27:00;4047;67;Southwest;RacesJerryFish;Volunteers needed to participate in someone he anyone anyone it users download the he app for more information #FTWdownloadCan;Volunteers needed to participate in someone he anyone anyone it users download the he app for more information #FTWdownloadCan;58;"VOLUNTEERS;RESCUE"
