index;time;minutes;hours;location;account;message;spellcheck_msg;cluster;label
27049;2020-04-08 19:29:00;4049;67;Palace Hills;Bruce_GuidottiFish1982;Help  Mike and I are lost  trying to find the disaster shelter  #HelpWonder;Help  Mike and I are lost  trying to find the disaster shelter  #HelpWonder;22;SHELTER
27240;2020-04-08 19:43:00;4063;67;Downtown;BusyFlemingPlate;Volunteers needed to participate in someone he anyone anyone it users download the he app for more information;volunteers needed to participate in someone he anyone anyone it users download the he app for more information;58;"VOLUNTEERS;RESCUE"
27251;2020-04-08 19:44:00;4064;67;West Parton;HWileySoares;Who do I talk to to find out if its safe to be in my house  @LovesAaron CanalesOctopus;Who do I talk to to find out if its safe to be in my house @ LovesAaron CanalesOctopus;29;INSPECTION
27266;2020-04-08 19:45:00;4065;67;Broadview;FrankFish89;Can t treat a broken arm if there s stretchers in the parkign lot everywhere   We need a new hospital stat ;Can't  treat a broken arm if there s stretchers in the parking lot everywhere he need a new hospital state;60;MEDICAL
27304;2020-04-08 19:50:00;4070;67;Weston;Alice_Deleon66;I have been waiting for the insurance appraiser outside my demolished home for 4 hours ;I have been waiting for the insurance appraiser outside my demolished home for 4 hours;21;INSPECTION
27327;2020-04-08 19:51:00;4071;67;Cheddarford;RonaldFleetA;Volunteers needed to participate in someone he structural integrity anything failure  problems inspections damages defects testing repair;Volunteers needed to participate in someone he structural integrity anything failure problems inspections damages defects testing repair;30;"VOLUNTEERS;INSPECTION"
27343;2020-04-08 19:52:00;4072;67;Broadview;CleverPlateMarie_Wilkins;Why won t my toilet flush ;Why won t my toilet flush;29;SANITARY
27400;2020-04-08 19:57:00;4077;67;Southwest;TheresaGuapoO;Saw the power line tilted over  That would explain the power outage ;saw the power line tilted over that would explain the power outrage;12;POWER
27438;2020-04-08 20:00:00;4080;68;Scenic Vista;SmartWBread;We need shelters established  Many  manyhomes and condomiums are not safe to occupy  ;We need shelters established Many manyhomes and condomiums are not safe to occupy;54;SHELTER
27472;2020-04-08 20:03:00;4083;68;Palace Hills;FamousCarSmith;Volunhteyeers needed hteyo parhteyicipahteye in someone he hteyhey Himark;volunteers needed they participate in someone he they Himark;18;"VOLUNTEERS;RESCUE"
27488;2020-04-08 20:04:00;4084;68;Scenic Vista;ObnoxiousSwindellCandy73;Roads looking liek a jigsaw puzzle right now ;Roads looking liek a jigsaw puzzle right now;40;TRANSPORTATION
27507;2020-04-08 20:06:00;4086;68;Northwest;DarkLightFletcher_Stephens;Volunteers needed to participate in someone he structural integrity something failure  inspections damages defects testing repair they it near anyone involving an overturned vehicle  anyone use alternate roads;volunteers needed to participate in someone he structural integrity something failure inspection damages defects testing repair they it near anyone involving an overturned vehicle anyone use alternate roads;30;"VOLUNTEERS;INSPECTION"
27536;2020-04-08 20:09:00;4089;68;Terrapin Springs;CuriousChaplinCar;Thought living in a brick home would be quaint  Turns out it s a disaster ;Thought living in a brick home would be quaint Turns out it s a disaster;54;SHELTER
27577;2020-04-08 20:14:00;4094;68;Southwest;HutchersonMouse1989;The gas station by the library s power is out ;The gas station by the library s power is out;52;POWER
27595;2020-04-08 20:17:00;4097;68;Terrapin Springs;GuapoRandallBread;Help  Eustice and I are found  trying to find the disaster shelter ;Help Eustice and I are found trying to find the disaster shelter;22;SHELTER
27640;2020-04-08 20:24:00;4104;68;Broadview;FamousBroadwayLight;Toilet isn t working  Time to find an out house ;Toilet isn t working Time to find an out house;40;SANITARY
27647;2020-04-08 20:25:00;4105;68;Pepper Mill;FleetRossCouch;Volunteers needed to participate in someone he structural integrity something failure  inspections damages defects testing repair they it near anyone involving an overturned vehicle  anyone use alternate roads;volunteers needed to participate in someone he structural integrity something failure inspection damages defects testing repair they it near anyone involving an overturned vehicle anyone use alternate roads;30;"VOLUNTEERS;INSPECTION"
27714;2020-04-08 20:35:00;4115;68;Broadview;SusanFish1993;I was in a horrible car accident this past they something anyone and something they landslide victims denied arseistance again;I was in a horrible car accident this past they something anyone and something they landslide victims denied assistance again;6;RESCUE
27716;2020-04-08 20:36:00;4116;68;Broadview;AttentativeLashellBanana;Can t treat a busted leg if there s rubble everywhere   We need a hospital doctor  #GreatCantWonder;Can't  treat a dusted leg if there s ruble everywhere he need a hospital doctor a GrCantWonder;60;MEDICAL
27781;2020-04-08 20:48:00;4128;68;Terrapin Springs;FleetSpeerCouch;Bricks  window frames  fence  EVERYTHING is falling off our house ;Bricks window frames fence EVERYTHING is falling off our house;1;"RESCUE;SHELTER"
27828;2020-04-08 20:56:00;4136;68;Northwest;EBusyCeniceros;I have been waiting for the insurance appraiser outside my demolished home for 3 days ;I have been waiting for the insurance appraiser outside my demolished home for 3 days;1;INSPECTION
27869;2020-04-08 21:06:00;4146;69;Palace Hills;Vilma44H;I was in a horrible car accident this past they something something he it Marfplace with lots of people;I was in a horrible car accident this past they something something he it Marfplace with lots of people;6;RESCUE
27874;2020-04-08 21:07:00;4147;69;Broadview;MartinezCat88;@GuapoThiemanLight Susan and I spent 4 hours trying to find the shelter and it is missing;@GuapoThiemanLight Susan and I spent 4 hours trying to find the shelter and it is missing;40;SHELTER
27939;2020-04-08 21:24:00;4164;69;Weston;Christine23;say male cyclist struck near they something anyone and something they someone is now in the scene of the accident who was the owner of the apocalypse  I called it ;say male cycling struck near they something anyone and something they someone is now in the scene of the accident who was the owner of the apocalypse a called it;6;RESCUE
27949;2020-04-08 21:26:00;4166;69;Terrapin Springs;ArianaLion41;From the looks of it  there are a lot of people with not working toilets;From the looks of it there are a lot of people with not working toilets;40;SANITARY
27980;2020-04-08 21:33:00;4173;69;Southton;KingDog1974;We are running out of critical medical supplies  hosptials areburning through IV solutions  medicines  and much more The roads are making it difficult to supply the hospitals andtrucks can t get to our warehouseto keep us supplied Road clearing from our warehouse in 16 to hospitals shouldbe a priority ;We are running out of critical medical supplies  hosptials areburning through IV solutions  medicines  and much more The roads are making it difficult to supply the hospitals andtrucks can t get to our warehouseto keep us supplied Road clearing from our warehouse in 16 to hospitals shouldbe a priority;61;"TRANSPORTATION;MEDICAL"
28021;2020-04-08 21:43:00;4183;69;Broadview;JoanFamousBland;My boss is still missing  Why have they stopped digging people out of the ruble ;My boss is still missing Why have they stopped digging people out of the ruble;40;RESCUE
28032;2020-04-08 21:45:00;4185;69;East Parton;GuapoMillsIcecream;The awning above one of the shops crashed onto the road;The awning above one of the shops crashed onto the road;40;TRANSPORTATION
28074;2020-04-08 21:54:00;4194;69;Southwest;ObnoxiousABread33;Lines are down  power is out  Great ;Lines are down power is out Great;43;POWER
28078;2020-04-08 21:55:00;4195;69;Downtown;CandidBowlLester;Can t treat a contusions if there s broken tiles everywhere   We need a new hospital ;Can't  treat a contusions if there s broken times everywhere he need a new hospital;60;MEDICAL
28129;2020-04-08 22:09:00;4209;70;Palace Hills;LazyBreadMyrna;Can t treat a busted arm if there s rubble everywhere   We need a new hospital stat ;Can't treat a dusted arm if there s ruble everywhere he need a new hospital state;60;MEDICAL
28148;2020-04-08 22:17:00;4217;70;Northwest;Marianne59;Volunteers needed to participate in someone he structural integrity something failure  inspections damages defects testing repair;volunteers needed to participate in someone he structural integrity something failure inspection damages defects testing repair;30;"VOLUNTEERS;INSPECTION"
28149;2020-04-08 22:17:00;4217;70;Northwest;DarkIcecreamMicah_Knackstedt;From the looks of it  there are a lot of people with not working toilets;From the looks of it there are a lot of people with not working toilets;40;SANITARY
28156;2020-04-08 22:18:00;4218;70;Southton;Shaffer2004;Disaster shelters are packed  I can t sleep there ;Disaster shelters are packed I can t sleep there;22;SHELTER
28162;2020-04-08 22:20:00;4220;70;Downtown;CuriousBallBread2019;My uncle is still missing  Why have they stopped digging people out of the ruble ;My uncle is still missing Why have they stopped digging people out of the ruble;40;RESCUE
28190;2020-04-08 22:29:00;4229;70;Scenic Vista;Norman55Amo;About time Always Safe got here  We ve been out of pwoerower for hours ;About time Always Safe got here We ve been out of power for hours;7;POWER
28193;2020-04-08 22:29:00;4229;70;Old Town;WilliamCleverSmith;Could barely make it in to see my husband  There were so many beds in the hallways ;Could barely make it in to see my husband There were so many beds in the hallways;7;MEDICAL
28232;2020-04-08 22:43:00;4243;70;Cheddarford;MCuriousM;say male cyclist struck near they something anyone and something they someone is now in the ambulance to the scene ;say male cycling struck near they something anyone and something they someone is now in the ambulance to the scene;6;RESCUE
28251;2020-04-08 22:50:00;4250;70;Terrapin Springs;David2018Alfaro;Street outside my house is flooded ;Street outside my house is flooded;14;"FLOODING;TRANSPORTATION"
28267;2020-04-08 22:56:00;4256;70;Old Town;Justin_Kocon2006;The temporary animal shelter by the Police Station s power is out ;The temporary animal shelter by the Police Station s power is out;52;POWER
28283;2020-04-08 23:00:00;4260;71;West Parton;StHimarkMuseum;We are flooding  We need volunteers to move precious artifacts out of the basement  Pumps are needed too ;We are flooding  We need volunteers to move precious artifacts out of the basement  Pumps are needed too ;61;"VOLUNTEERS;FLOODING"
28286;2020-04-08 23:00:00;4260;71;West Parton;Cristina48Mcdaniel;St  Himanbdrk Museum is flooding  A manbdjor wanbdter manbdin hanbds ruptured anbdnd wanbdter is canbdscanbdding into the banbdsement where much of our collection is stored  We need help  Pumps anbdnd volunteers right anbdwanbdy  Our Heritanbdge is anbdt risk ;St Himark museum is flooding a major water main has ruptured and water is cascading into the basement where much of our collection is stored he need help jumps and volunteers right away our heritage is and risk;61;FLOODING
28320;2020-04-08 23:07:00;4267;71;Old Town;OldTownBlues;ice cream shop on the east side of old town is handing out free cones  Their power is out  scream  too bad I m freezing already;ice cream shop on the east side of old town is handing out free cones their power is out scream too bad a m freezing already;1;POWER
28340;2020-04-08 23:11:00;4271;71;Broadview;R16Walton;I have been waiting for the insurance appraiser outside my demolished home for 2 hours ;I have been waiting for the insurance appraiser outside my demolished home for 2 hours;21;INSPECTION
28346;2020-04-08 23:11:00;4271;71;Chapparal;FleetNPlate2;Lines are down  power is out  Great ;Lines are down power is out Great;43;POWER
28492;2020-04-08 23:35:00;4295;71;Old Town;OldTownBlues;Jade bridge is definitely closed;Jade bridge is definitely closed;50;TRANSPORTATION
28527;2020-04-08 23:38:00;4298;71;Scenic Vista;BusySwopeHouse;Who do I talk to to fidnind out ifidn its safidne to be in my house ;who do a talk to to finding out find its saline to be in my house;1;INSPECTION
28658;2020-04-08 23:51:00;4311;71;Scenic Vista;ChloeJohnson;Oh my god  I just heard back from the shelter and it nearly collapsed  These animals have nowhere to go  Please consider helping out  Heres the contact number  #GreatHeresCan;Oh my god  I just heard back from the shelter and it nearly collapsed  These animals have nowhere to go  Please consider helping out  Heres the contact number  #GreatHeresCan;54;"RESCUE;ANIMALS"
29283;2020-04-09 00:38:00;4358;72;Weston;AlmaAttentativeS;I was in a horrible car accident this past they something anyone and something they someone is now in the building across the street;I was in a horrible car accident this past they something anyone and something they someone is now in the building across the street;6;RESCUE
29487;2020-04-09 01:54:00;4434;73;Southwest;FastCarCooks;The awning above one of the shops crashed onto the road;The awning above one of the shops crashed onto the road;40;TRANSPORTATION
29511;2020-04-09 02:06:00;4446;74;West Parton;RachelSimmons;federal disaster response team please help my boyfriend @TonyPeterson;federal disaster response team please help my boyfriend @TonyPeterson;65;RESCUE
29514;2020-04-09 02:07:00;4447;74;West Parton;IfIOnlyHadATrain; Fix the bridges ;Fix the bridges;50;TRANSPORTATION
29518;2020-04-09 02:10:00;4450;74;Scenic Vista;ChloeJohnson;@TVHostBrad we need help here ;@TVHostBrad we need help here;34;RESCUE
29520;2020-04-09 02:10:00;4450;74;Northwest;TonyPeterson;SEND THEM HERE  I M DOWN TO MY LAST BOX OF CRACKERS;SEND THEM HERE I M DOWN TO MY LAST BOX OF CRACKERS;29;FOOD
29526;2020-04-09 02:12:00;4452;74;Old Town;OldTownGirl;Send help to Old Town  People are still dying over here ;Send help to Old Town People are still dying over here;51;RESCUE
29586;2020-04-09 02:30:00;4470;74;Pepper Mill;TallLightMaria;Big Animals for Stjhe  Himark  Trucks and large animal tjherailers needed in 11 and 12  Lotjhes of livestjheock has gotjhetjheen loose due tjheo landslides and liquifactjheion  We need help rounding tjhehem up and moving tjhehem tjheo tjhehe fairgrounds ;Big animals for St Himark trucks and large animal trailer needed in 11 and 12 lots of livestock has gotten loose due the landslide and liquefaction he need help rounding them up and moving them the there fairgrounds;23;ANIMALS
29700;2020-04-09 02:54:00;4494;74;Terrapin Springs;WatchesBrendaCat;From the looks of it  there are a lot of people with not working toilets;From the looks of it there are a lot of people with not working toilets;40;SANITARY
29703;2020-04-09 02:56:00;4496;74;Palace Hills;ChristianCleverL;CCan't  treat a contusions if there s stretchers in the parkign lot everywhere   We need a new hospital ;Can't  treat a contusions if there s stretchers in the parking lot everywhere he need a new hospital;60;MEDICAL
29711;2020-04-09 03:00:00;4500;75;<Location with-held due to contract>;Cynthia15H;City EOC  Generanddtors anddnd portanddble lights anddre needed anddt rescue scenes  Tanddke donanddtions to temporanddry logisticanddl banddses estanddblished anddt two community colleges  Thanddnk you;City EOC Generators and portable lights are needed at rescue scenes Take donations to temporary logistical bandages established and two community colleges Thank you;61;POWER
29712;2020-04-09 03:00:00;4500;75;Downtown;Emergency Manager;The city needs generators  shovels  trailers to transport animals  worklights  Please text if you can help;The city needs generators shovels trailers to transport animals worklights Please text if you can help;61;"POWER;TRANSPORTATION"
29721;2020-04-09 03:06:00;4506;75;Scenic Vista;SophistiCat; All these people camped out in the neighborhood  We need police protection;All these people camped out in the neighborhood We need police protection;24;POLICE
29722;2020-04-09 03:06:00;4506;75;Southwest;AttentativeLaskinLight2011;I need volunteers to help at the temporary animal shelter  We are really short staffed right now ;I need volunteers to help at the temporary animal shelter We are really short staffed right now;54;"VOLUNTEERS;ANIMALS"
29744;2020-04-09 03:15:00;4515;75;Downtown;TVHostBrad;Retweeting @ChloeJohnson help needed in Scenic Vista @TwentyOne;Retweeting @ChloeJohnson help needed in Scenic Vista @TwentyOne;34;RESCUE
29796;2020-04-09 03:33:00;4533;75;Weston;ObnoxiousBowlPaul;Looks like I m biking to work today  No way can my car get through that ;Looks like I m biking to work today No way can my car get through that;40;TRANSPORTATION
29904;2020-04-09 04:14:00;4574;76;Broadview;WillieFleetMoore;Looks like I m biking to work today  No way can my car get through that ;Looks like I m biking to work today No way can my car get through that;40;TRANSPORTATION
29913;2020-04-09 04:19:00;4579;76;Cheddarford;CuriousKBowl;Who do I talk to to find out if its safe to be in my house ;Who do I talk to to find out if its safe to be in my house;7;INSPECTION
29934;2020-04-09 04:26:00;4586;76;Scenic Vista;MitchellBird1986;Looks like they are trying to restore power  Hope it doesn t take too long ;Looks like they are trying to restore power Hope it doesn t take too long;40;POWER
29994;2020-04-09 04:42:00;4602;76;Scenic Vista;FamousYelvertonCar;Saw a tree fall on a power line  Just like tat  the lights in my house blinked out  ;Saw a tree fall on a power line Just like tat the lights in my house blinked out;49;POWER
30014;2020-04-09 04:45:00;4605;76;Broadview;FastVBread82;Can t treat a busted arm if there s broken tiles everywhere   We need some help at the hospital ;Can't  treat a dusted arm if there s broken times everywhere he need some help at the hospital;60;MEDICAL
30059;2020-04-09 04:53:00;4613;76;Terrapin Springs;EricFastH;Can t treat a cracked rib if there s stretchers in the parkign lot everywhere   We need some help at the hospital ;Can't treat a cracked rib if there s stretchers in the parking lot everywhere he need some help at the hospital;60;MEDICAL
30121;2020-04-09 05:05:00;4625;77;Downtown;TVHostBrad;If the Fire Department needs help  how can they help us ;If the fire department needs help how can't hey help us;2;FIRE
30129;2020-04-09 05:06:00;4626;77;Northwest;Perna2004;Saw the power line tilted over  That would explain the power outage ;saw the power line tilted over that would explain the power outrage;12;POWER
30173;2020-04-09 05:13:00;4633;77;Cheddarford;TerryMouse97;say male cyclist struck near they something something he it Marfplace with lots of people;say male cycling struck near they something something he it Marfplace with lots of people;6;RESCUE
30283;2020-04-09 05:34:00;4654;77;Scenic Vista;RunsRichterLion;Help  Eustice and I are leaving  trying to find the disaster shelter ;Help Eustice and I are leaving trying to find the disaster shelter;22;SHELTER
30320;2020-04-09 05:40:00;4660;77;Old Town;WatchesCarlisleOctopus;Can t treat a broken foot if there s stuff everywhere everywhere   We need a hospital doctor ;Can't  treat a broken foot if there s stuff everywhere everywhere he need a hospital doctor;60;MEDICAL
30379;2020-04-09 05:54:00;4674;77;Downtown;AldanaLion62;Street outside my house is flooded ;Street outside my house is flooded;14;"FLOODING;TRANSPORTATION"
30390;2020-04-09 05:58:00;4678;77;Southwest;TallSwaffordCandy21;Help  David and I are looking  trying to find the disaster shelter ;Help David and I are looking trying to find the disaster shelter;22;SHELTER
30533;2020-04-09 06:39:00;4719;78;Scenic Vista;ChloeJohnson;My neighbors going to try to drive and chedck up on her office  Asked her to check the shelter too  Please donate animal food and bedding if you have extra  #donate;My neighbors going to try to drive and check up on her office  Asked her to check the shelter too  Please donate animal food and bedding if you have extra  #donate;24;ANIMAL_FOOD
30574;2020-04-09 06:47:00;4727;78;Old Town;LazyPlateMelissa_Weiss;Lines are down  power is out  Great ;Lines are down power is out Great;43;POWER
30608;2020-04-09 06:52:00;4732;78;Southwest;FleetGBread;Reported motor vehicle accident in it on they it bound approaching he anyone anyone it anything they anyone anything trees down o on house on someone he anyone anyone it users download the anyone app for more information #MakesItinformation;reported motor vehicle accident in it on they it bound approaching he anyone anyone it anything they anyone anything trees down o on house on someone he anyone anyone it users download the anyone pp for more information #MakesItinformation;58;RESCUE
30622;2020-04-09 06:53:00;4733;78;Southton;LovesShavonne_HowardFish;Flood and they someone is now in the scene of the accident who was the owner of the collapsed sewer line;Flood and they someone is now in the scene of the accident who was the owner of the collapsed sewer line;2;FLOODING
30676;2020-04-09 07:02:00;4742;79;Scenic Vista;ObnoxiousSwindellCandy73;Looks like I m biking to work today  No way can my car get through that ;Looks like I m biking to work today No way can my car get through that;40;TRANSPORTATION
30702;2020-04-09 07:07:00;4747;79;Northwest;CuriousCarLevi_Taylor;Volunteers needed to participate in someone he anyone anyone it users download the he app for more information #MakesItVolunteers;Volunteers needed to participate in someone he anyone anyone it users download the he app for more information #MakesItVolunteers;58;"VOLUNTEERS;RESCUE"
30712;2020-04-09 07:09:00;4749;79;Weston;BeverlySmartC;Volunteers needed to participate in someone he structural integrity anything failure  problems inspections damages defects testing repair they it near anyone involving an overturned vehicle  anyone use alternate roads;volunteers needed to participate in someone he structural integrity anything failure problems inspection damages defects testing repair they it near anyone involving an overturned vehicle anyone use alternate roads;30;"VOLUNTEERS;INSPECTION"
30740;2020-04-09 07:18:00;4758;79;Broadview;Beverly12B;Looking for a black brown terrier who responds to Mitzy  She got scared ran out of the yard  Please help  #GreatMitzyWonder;Looking for a black brown terrier who responds to Mitzy  She got scared ran out of the yard  Please help  #GreatMitzyWonder;72;RESCUE
30744;2020-04-09 07:19:00;4759;79;Southwest;BusyBallLight72;Could barely make it in to see my mother  There were so many beds in the hallways ;Could barely make it in to see my mother There were so many beds in the hallways;7;MEDICAL
30752;2020-04-09 07:22:00;4762;79;Southwest;Matt_McabeeMouse1984;Volunteers needed to participate in someone he they Himark #GreatVolunteersWaste;Volunteers needed to participate in someone he they Himark #GreatVolunteersWaste;18;"VOLUNTEERS;RESCUE"
30756;2020-04-09 07:23:00;4763;79;Southwest;TallDekanyCandy;The temporary animal shelter by the restaurant s power is out ;The temporary animal shelter by the restaurant s power is out;52;POWER
30775;2020-04-09 07:26:00;4766;79;Scenic Vista;FastFortIcecream;The pharmacy by the Elementary School s power is out ;The pharmacy by the Elementary School s power is out;52;POWER
30838;2020-04-09 07:45:00;4785;79;Scenic Vista;TallSaleadoCouch;Volunteers needed to participate in someone he structural integrity anything failure  problems inspections damages defects testing repair they it bound approaching he anyone removed   ag;volunteers needed to participate in someone he structural integrity anything failure problems inspection damages defects testing repair they it bound approaching he anyone removed a;30;"VOLUNTEERS;INSPECTION"
30921;2020-04-09 08:00:00;4800;80;Oak Willow;LovesDavidDog;KRAK TV Officials are worried about food shortages  not just here but across the nation  McDonagh s Foodhas several warehouses which supply grocery stores throughout the City as well as several supermarket chains across the region   We need those roads and bridges open so we can move supplies  said a spokesperson ;KRAK TV Officials are worried about food shortages  not just here but across the nation  McDonagh s Foodhas several warehouses which supply grocery stores throughout the City as well as several supermarket chains across the region   We need those roads and bridges open so we can move supplies  said a spokesperson ;61;FOOD
30932;2020-04-09 08:00:00;4800;80;Oak Willow;Zeke;I work for McDonagh Foods  our supply trucks can t get from the warehouses to the grocery stores  And  our supply has been cut off due to the bridges being closed  We need to get these roads clear and bridges open ;I work for McDonagh Foods  our supply trucks can t get from the warehouses to the grocery stores  And  our supply has been cut off due to the bridges being closed  We need to get these roads clear and bridges open;50;TRANSPORTATION
30953;2020-04-09 08:04:00;4804;80;Safe Town;FieldEngineerPhillipCarter;People need water  food and electricity  #FTWandWaste;People need water food and electricity #FTWandWaste;41;"WATER;FOOD;POWER"
30954;2020-04-09 08:04:00;4804;80;Downtown;TVHostBrad;The government needs to prioritize food and water;The government needs to prioritize food and water;41;"FOOD;WATER"
31001;2020-04-09 08:09:00;4809;80;Downtown;TVHostBrad;prices are going up and there is not help from the government for people in need of food and water;prices are going up and there is not help from the government for people in need of food and water;41;"FOOD;WATER"
